drop table if exists t1;
CREATE TABLE t1 (a tinyint(3), b tinyint(5));
INSERT INTO t1 VALUES (1,1);
INSERT LOW_PRIORITY INTO t1 VALUES (1,2);
INSERT INTO t1 VALUES (1,3);
select a,b from t1;
a	b
1	1
1	2
1	3
DELETE from t1 where b=1;
select a,b from t1;
a	b
1	2
1	3
drop table if exists t1;
create table t1 (
	a bigint not null,
	b bigint not null default 0,
	c bigint not null default 0,
	d bigint not null default 0,
	e bigint not null default 0,
	f bigint not null default 0,
	g bigint not null default 0,
	h bigint not null default 0,
	i bigint not null default 0,
	j bigint not null default 0,
	);
insert into t1 (a) values (2),(4),(6),(8),(10),(12),(14),(16),(18),(20),(22),(24),(26),(23);
delete from t1 where a=26;
select count(*) from t1;
13
